RG DeptNo,Department
5,Canadian Commercial Corporation
5,"Department of Foreign Affairs, Trade and Development"
5,International Development Research Centre
7,Impact Assessment Agency of Canada
7,Department of the Environment
21,Department of Veterans Affairs
21,Veterans Review and Appeal Board
33,Department of Industry
33,Standards Council of Canada
33,Canadian Tourism Commission
34,Canadian Air Transport Security Authority
34,Marine Atlantic Inc.
34,The Federal Bridge Corporation Limited
34,VIA HFR - VIA TGF Inc.
34,Department of Transport
34,VIA Rail Canada Inc.
41,Atomic Energy of Canada Limited
41,Department of Natural Resources
44,Pacific Economic Development Agency of Canada
44,Department of Western Economic Diversification
88,Royal Canadian Mounted Police External Review Committee
88,Office of the Correctional Investigator of Canada
88,Civilian Review and Complaints Commission for the Royal Canadian Mounted Police
88,Department of Public Safety and Emergency Preparedness
127,Canada Post Corporation
127,Department of Public Works and Government Services
127,National Capital Commission
135,Canadian Broadcasting Corporation
135,Canada Council for the Arts
135,Department of Canadian Heritage
135,Canadian Museum of History
135,Canadian Museum for Human Rights
135,Canadian Museum of Immigration at Pier 21
135,Canadian Museum of Nature
135,Canadian Race Relations Foundation
135,National Arts Centre Corporation
135,National Gallery of Canada
135,National Museum of Science and Technology
142,The Jacques-Cartier and Champlain Bridges Inc.
142,Office of Infrastructure of Canada
142,Windsor-Detroit Bridge Authority
